{
  "$schema": "https://json-schema.org/draft/2020-12/schema",
  "title": "Briefing evidence ledger v1",
  "type": "object",
  "required": [
    "schema_version",
    "fixture",
    "author",
    "report_date",
    "claims"
  ],
  "properties": {
    "schema_version": {
      "const": 1
    },
    "fixture": {
      "type": "boolean"
    },
    "author": {
      "type": "string",
      "minLength": 1
    },
    "report_date": {
      "type": "string",
      "format": "date",
      "pattern": "^\\d{4}-\\d{2}-\\d{2}$"
    },
    "claims": {
      "type": "array",
      "minItems": 1,
      "items": {
        "type": "object",
        "required": [
          "id",
          "text",
          "kinds",
          "author_status",
          "event_date",
          "uncertainty",
          "sources"
        ],
        "properties": {
          "id": {
            "type": "string",
            "pattern": "^C[0-9]{3,}$"
          },
          "text": {
            "type": "string",
            "minLength": 1
          },
          "kinds": {
            "type": "array",
            "minItems": 1,
            "uniqueItems": true,
            "items": {
              "enum": [
                "factual",
                "technical",
                "legal",
                "list",
                "negative",
                "statistic",
                "company_response"
              ]
            }
          },
          "author_status": {
            "enum": [
              "supported",
              "unsupported",
              "unverified"
            ]
          },
          "event_date": {
            "anyOf": [
              {
                "type": "string",
                "format": "date",
                "pattern": "^\\d{4}-\\d{2}-\\d{2}$"
              },
              {
                "type": "null"
              }
            ]
          },
          "uncertainty": {
            "type": "string"
          },
          "sources": {
            "type": "array",
            "items": {
              "type": "object",
              "required": [
                "url",
                "publication_date",
                "date_checked",
                "quote",
                "anchor",
                "evidence_type",
                "source_role",
                "access_status",
                "notes"
              ],
              "properties": {
                "url": {
                  "type": "string",
                  "format": "uri",
                  "pattern": "^https?://"
                },
                "publication_date": {
                  "anyOf": [
                    {
                      "type": "string",
                      "pattern": "^\\d{4}-\\d{2}-\\d{2}(?:T\\d{2}:\\d{2}(?::\\d{2}(?:\\.\\d{1,6})?)?(?:Z|[+-]\\d{2}:\\d{2})?)?$"
                    },
                    {
                      "type": "null"
                    }
                  ]
                },
                "date_checked": {
                  "anyOf": [
                    {
                      "type": "string",
                      "pattern": "^\\d{4}-\\d{2}-\\d{2}(?:T\\d{2}:\\d{2}(?::\\d{2}(?:\\.\\d{1,6})?)?(?:Z|[+-]\\d{2}:\\d{2})?)?$"
                    },
                    {
                      "type": "null"
                    }
                  ]
                },
                "quote": {
                  "type": "string"
                },
                "anchor": {
                  "type": "string"
                },
                "evidence_type": {
                  "enum": [
                    "official_document",
                    "company_statement",
                    "news",
                    "dataset",
                    "other"
                  ]
                },
                "source_role": {
                  "enum": [
                    "primary",
                    "secondary"
                  ]
                },
                "access_status": {
                  "enum": [
                    "opened",
                    "blocked",
                    "unchecked"
                  ]
                },
                "notes": {
                  "type": "string"
                },
                "access_route": {
                  "enum": ["http_tool", "browser", "api", "reprint"],
                  "description": "How the writer obtained the text: automated fetch, reading in a browser, an official API, or an official reprint. Reported separately in review_report.md; it never upgrades evidence."
                },
                "source_name": {
                  "type": "string",
                  "description": "Short publisher name used as the link label (e.g. 商务部, Reuters)"
                },
                "recheck_reason": {
                  "type": "string"
                },
                "snapshot": {
                  "type": "object",
                  "description": "Saved copy of the source text, written by scripts/save_snapshot.py; lets the quote be checked offline",
                  "required": ["path", "sha256"],
                  "properties": {
                    "path": {"type": "string", "description": "Relative to the ledger's folder"},
                    "sha256": {"type": "string", "pattern": "^[0-9a-f]{64}$"},
                    "retrieved_at": {"type": "string"},
                    "method": {"type": "string"}
                  }
                }
              }
            }
          }
        }
      }
    },
    "timezone": {
      "type": "string",
      "description": "IANA timezone; legacy date-only convention is UTC"
    },
    "cutoff": {
      "anyOf": [
        {
          "type": "string",
          "pattern": "^\\d{4}-\\d{2}-\\d{2}(?:T\\d{2}:\\d{2}(?::\\d{2}(?:\\.\\d{1,6})?)?(?:Z|[+-]\\d{2}:\\d{2})?)?$"
        },
        {
          "type": "null"
        }
      ]
    },
    "generated_at": {
      "anyOf": [
        {
          "type": "string",
          "pattern": "^\\d{4}-\\d{2}-\\d{2}(?:T\\d{2}:\\d{2}(?::\\d{2}(?:\\.\\d{1,6})?)?(?:Z|[+-]\\d{2}:\\d{2})?)?$"
        },
        {
          "type": "null"
        }
      ]
    }
  }
}
